{
  "_id": "66f0a1b2c3d4e5f6a7b8c9d4",
  "schema_version": 1,
  "survey_id": "66f0a1b2c3d4e5f6a7b8c9d0",
  "survey_version_id": "66f0a1b2c3d4e5f6a7b8c9d1",
  "respondent_id": "651f1c2a9b3e4d5f6a7b8c9e",
  "is_anonymous": false,
  "submission_token": "8b1d4e6f-2a9c-4c7b-bf53-0e6a7c9d1f42",
  "answers": [
    {
      "question_id": "q_role_0001",
      "type": "single_choice",
      "option_ids": [
        "o_student_0001"
      ]
    },
    {
      "question_id": "q_resources_0002",
      "type": "multi_choice",
      "option_ids": [
        "o_slides_0001",
        "o_lab_0000001"
      ]
    },
    {
      "question_id": "q_rating_0004",
      "type": "number",
      "number": 5
    },
    {
      "question_id": "q_recommend_0006",
      "type": "single_choice",
      "option_ids": [
        "o_yes_0000001"
      ]
    }
  ],
  "submitted_at": "2026-10-19T03:42:10Z"
}
