{
  "_id": "66f0a1b2c3d4e5f6a7b8c9d2",
  "schema_version": 1,
  "survey_id": "66f0a1b2c3d4e5f6a7b8c9d0",
  "survey_version_id": "66f0a1b2c3d4e5f6a7b8c9d1",
  "respondent_id": null,
  "is_anonymous": true,
  "submission_token": "2e7c4b9a-6f31-4d58-9c2e-7a1b0d3f5c88",
  "answers": [
    {
      "question_id": "q_role_0001",
      "type": "single_choice",
      "option_ids": [
        "o_student_0001"
      ]
    },
    {
      "question_id": "q_resources_0002",
      "type": "multi_choice",
      "option_ids": [
        "o_slides_0001",
        "o_videos_0001"
      ]
    },
    {
      "question_id": "q_nolab_0003",
      "type": "text",
      "text": "实验环境需要额外配置，平时没有时间。"
    },
    {
      "question_id": "q_rating_0004",
      "type": "number",
      "number": 2
    },
    {
      "question_id": "q_improve_0005",
      "type": "text",
      "text": "希望提供可离线运行的实验镜像。"
    },
    {
      "question_id": "q_recommend_0006",
      "type": "single_choice",
      "option_ids": [
        "o_no_00000001"
      ]
    }
  ],
  "submitted_at": "2026-10-19T02:15:30Z"
}
